Ervin Howell,False,suscipit repellat esse quibusdam voluptatem incidunt,2
Ervin Howell,True,distinctio vitae autem nihil ut molestias quo,2
Ervin Howell,False,2,et itaque necessitatibus maxime molestiae qui quas velit
Ervin Howell,False,2,adipisci non ad dicta qui amet quaerat doloribus ea
Ervin Howell,True,2,voluptas quo tenetur perspiciatis explicabo natus
Ervin Howell,True,aliquam aut quasi,2
Ervin Howell,True,veritatis pariatur delectus,2
Ervin Howell,False,nesciunt totam sit blanditiis sit,2
Ervin Howell,False,laborum aut in quam,2
Ervin Howell,True,2,nemo perspiciatis repellat ut dolor libero commodi blanditiis omnis
Ervin Howell,False,repudiandae totam in est sint facere fuga,2
Ervin Howell,False,2,earum doloribus ea doloremque quis
Ervin Howell,False,2,sint sit aut vero
Ervin Howell,False,porro aut necessitatibus eaque distinctio,2
Ervin Howell,True,repellendus veritatis molestias dicta incidunt,2
Ervin Howell,True,2,excepturi deleniti adipisci voluptatem et neque optio illum ad
Ervin Howell,False,sunt cum tempora,2
Ervin Howell,False,2,totam quia non
Ervin Howell,False,doloremque quibusdam asperiores libero corrupti illum qui omnis,2
Ervin Howell,True,2,totam atque quo nesciunt
